{
  "schema_version": "shared_model_manifest.v1",
  "architecture_version": 1,
  "task_kind": "next_purchase",
  "preprocessing_version": "prep-dummy-0",
  "text_artifact_hash": "3f8c1b2d4e6a7c9b0d1e2f3a4b5c6d7e8f90a1b2c3d4e5f60718293a4b5c6d7e",
  "tensors": [
    {
      "name": "shared.time_mlp",
      "shape": [
        3,
        8
      ],
      "dtype": "float32"
    },
    {
      "name": "shared.scorer",
      "shape": [
        8,
        8
      ],
      "dtype": "float32"
    }
  ],
  "manifest_hash": "a1b2c3d4e5f60718293a4b5c6d7e8f903f8c1b2d4e6a7c9b0d1e2f3a4b5c6d7e"
}
